{
  "$schema": "https://json-schema.org/draft/2020-12/schema",
  "$id": "https://github.com/koreagorani/macro-monitor/blob/main/data/schema/risk-output.schema.json",
  "title": "Risk Model Output",
  "type": "object",
  "additionalProperties": false,
  "required": [
    "schemaVersion",
    "asOf",
    "quality",
    "indicatorStatuses",
    "areaRisks",
    "overallRisk",
    "warnings"
  ],
  "properties": {
    "schemaVersion": { "type": "string", "const": "1.0.0" },
    "asOf": { "type": "string", "format": "date" },
    "quality": { "$ref": "#/$defs/quality" },
    "indicatorStatuses": {
      "type": "array",
      "items": { "$ref": "#/$defs/indicatorStatus" }
    },
    "areaRisks": {
      "type": "array",
      "items": { "$ref": "#/$defs/areaRisk" }
    },
    "overallRisk": {
      "oneOf": [
        { "type": "null" },
        { "$ref": "#/$defs/overallRisk" }
      ]
    },
    "warnings": {
      "type": "array",
      "items": { "$ref": "#/$defs/warning" }
    }
  },
  "$defs": {
    "quality": {
      "type": "object",
      "additionalProperties": false,
      "required": [
        "shouldAbort",
        "confidence",
        "coreIndicatorIds",
        "nonCoreIndicatorIds",
        "failedCoreIndicators",
        "failedNonCoreIndicators",
        "availableIndicatorCount",
        "unavailableIndicatorCount",
        "warnings"
      ],
      "properties": {
        "shouldAbort": { "type": "boolean" },
        "confidence": { "type": "string", "enum": ["normal", "reduced", "aborted"] },
        "coreIndicatorIds": { "type": "array", "items": { "type": "string" } },
        "nonCoreIndicatorIds": { "type": "array", "items": { "type": "string" } },
        "failedCoreIndicators": { "type": "array", "items": { "$ref": "#/$defs/failedIndicator" } },
        "failedNonCoreIndicators": { "type": "array", "items": { "$ref": "#/$defs/failedIndicator" } },
        "availableIndicatorCount": { "type": "integer", "minimum": 0 },
        "unavailableIndicatorCount": { "type": "integer", "minimum": 0 },
        "warnings": { "type": "array", "items": { "$ref": "#/$defs/warning" } }
      }
    },
    "failedIndicator": {
      "type": "object",
      "additionalProperties": false,
      "required": ["indicatorId", "reason"],
      "properties": {
        "indicatorId": { "type": "string" },
        "reason": { "type": "string", "enum": ["missing_output", "unavailable"] }
      }
    },
    "indicatorStatus": {
      "type": "object",
      "additionalProperties": false,
      "required": [
        "indicatorId",
        "available",
        "status",
        "score",
        "selectedEvaluation",
        "evaluations",
        "warnings"
      ],
      "properties": {
        "indicatorId": { "type": "string" },
        "available": { "type": "boolean" },
        "status": { "$ref": "#/$defs/status" },
        "score": { "type": ["number", "null"] },
        "selectedEvaluation": {
          "oneOf": [
            { "type": "null" },
            { "$ref": "#/$defs/metricEvaluation" }
          ]
        },
        "evaluations": { "type": "array", "items": { "$ref": "#/$defs/metricEvaluation" } },
        "warnings": { "type": "array", "items": { "$ref": "#/$defs/warning" } }
      }
    },
    "metricEvaluation": {
      "type": "object",
      "additionalProperties": false,
      "required": [
        "metricPath",
        "unit",
        "value",
        "status",
        "score",
        "matchedRuleId",
        "signal"
      ],
      "properties": {
        "metricPath": { "type": "string" },
        "unit": { "type": "string" },
        "value": { "type": ["number", "null"] },
        "status": { "$ref": "#/$defs/status" },
        "score": { "type": ["number", "null"] },
        "matchedRuleId": { "type": ["string", "null"] },
        "signal": { "type": ["string", "null"] }
      }
    },
    "areaRisk": {
      "type": "object",
      "additionalProperties": false,
      "required": [
        "areaId",
        "name",
        "weight",
        "score",
        "status",
        "contributingIndicators",
        "warnings"
      ],
      "properties": {
        "areaId": { "type": "string" },
        "name": { "type": "string" },
        "weight": { "type": "number" },
        "score": { "type": ["number", "null"] },
        "status": { "$ref": "#/$defs/status" },
        "contributingIndicators": {
          "type": "array",
          "items": { "$ref": "#/$defs/areaContribution" }
        },
        "warnings": { "type": "array", "items": { "$ref": "#/$defs/warning" } }
      }
    },
    "areaContribution": {
      "type": "object",
      "additionalProperties": false,
      "required": [
        "indicatorId",
        "status",
        "score",
        "areaWeight",
        "weightedScore"
      ],
      "properties": {
        "indicatorId": { "type": "string" },
        "status": { "$ref": "#/$defs/status" },
        "score": { "type": "number" },
        "areaWeight": { "type": "number" },
        "weightedScore": { "type": "number" }
      }
    },
    "overallRisk": {
      "type": "object",
      "additionalProperties": false,
      "required": [
        "level",
        "score",
        "label",
        "reasons",
        "triggeredRules",
        "confidence"
      ],
      "properties": {
        "level": {
          "type": "string",
          "enum": ["normal", "watch", "alert", "high_risk"]
        },
        "score": { "type": ["number", "null"] },
        "label": { "type": "string" },
        "reasons": {
          "type": "array",
          "items": { "type": "string", "minLength": 1 }
        },
        "triggeredRules": {
          "type": "array",
          "items": { "type": "string", "minLength": 1 }
        },
        "confidence": { "type": "string", "enum": ["normal", "reduced", "aborted"] }
      }
    },
    "warning": {
      "type": "object",
      "additionalProperties": false,
      "required": ["code", "message", "indicatorId"],
      "properties": {
        "code": { "type": "string", "minLength": 1 },
        "message": { "type": "string", "minLength": 1 },
        "indicatorId": { "type": ["string", "null"] }
      }
    },
    "status": {
      "type": "string",
      "enum": ["easing", "normal", "watch", "alert", "strong_alert", "unavailable"]
    }
  }
}
